{
  "$schema": "https://json-schema.org/draft/2020-12/schema",
  "$id": "https://example.invalid/designer-parity/tool-contract.schema.json",
  "title": "Independent tool contract (generated by scripts/build_status.py)",
  "type": "object",
  "additionalProperties": false,
  "required": ["id", "target_version", "name", "category", "status", "inputs", "outputs", "configuration_schema", "sources", "cases"],
  "properties": {
    "id": {"type": "string", "minLength": 2},
    "target_version": {"type": "string"},
    "name": {"type": "string"},
    "category": {"type": "string"},
    "xml_tool_name": {"type": ["string", "null"]},
    "user_role": {"type": ["string", "null"]},
    "documentation_url": {"type": ["string", "null"]},
    "status": {"enum": ["not-started", "specified", "in-progress", "implemented", "verified", "blocked"]},
    "implementation_status": {"enum": ["not-started", "in-progress", "implemented", "blocked"]},
    "verification_status": {"enum": ["not-tested", "partial", "verified", "failed", "blocked"]},
    "inputs": {"type": "array", "items": {"$ref": "#/$defs/anchor"}},
    "outputs": {"type": "array", "items": {"$ref": "#/$defs/anchor"}},
    "configuration_schema": {"type": "object"},
    "deterministic": {"type": ["boolean", "null"]},
    "external_dependencies": {"type": "array", "items": {"type": "string"}},
    "external_prerequisites_blocking": {"type": "boolean"},
    "license_notes": {"type": "string"},
    "implementation": {"type": ["object", "null"]},
    "reference_observation": {"type": ["object", "null"]},
    "public_doc": {"type": ["object", "null"]},
    "independent_tests": {"type": "object"},
    "sources": {"type": "array", "items": {"type": "object", "required": ["url", "evidence_type"], "properties": {"url": {"type": "string"}, "evidence_type": {"type": "string"}, "accessed_utc": {"type": ["string", "null"]}}}},
    "cases": {"type": "array", "items": {"type": "object", "required": ["case_id", "status"], "properties": {"case_id": {"type": "string"}, "status": {"enum": ["not-tested", "passed", "failed", "blocked"]}, "evidence": {"type": "array", "items": {"type": "string"}}}}},
    "unresolved": {"type": "array", "items": {"type": "string"}}
  },
  "$defs": {"anchor": {"type": "object", "required": ["name", "direction", "cardinality"], "properties": {"name": {"type": "string"}, "direction": {"enum": ["input", "output"]}, "cardinality": {"enum": ["one", "many", "zero-or-one", "unknown"]}, "provenance": {"type": "string"}, "reference_name": {"type": ["string", "null"]}, "schema": {"type": ["object", "null"]}}}}
}
