{
  "id": "in-database:macro-input-in-db",
  "target_version": "Designer 2026.1.4.126 (pinned public catalogue); reference observations from installed build 2026.2.0.8",
  "name": "Macro Input In-DB",
  "category": "In-Database",
  "xml_tool_name": "LockInGui.LockInMacroInput.LockInMacroInput",
  "user_role": "Full",
  "documentation_url": "https://help.alteryx.com/current/en/designer/tools/in-database/macro-input-in-db-tool.html",
  "status": "implemented",
  "implementation_status": "implemented",
  "verification_status": "not-tested",
  "inputs": [],
  "outputs": [
    {
      "name": "output",
      "direction": "output",
      "cardinality": "one",
      "provenance": "flowengine-manifest",
      "reference_name": null
    }
  ],
  "configuration_schema": {
    "type": "object",
    "additionalProperties": false,
    "required": [
      "name"
    ],
    "properties": {
      "name": {
        "type": "string",
        "minLength": 1
      }
    }
  },
  "deterministic": true,
  "external_dependencies": [
    "database-connection (SQL pushdown target)",
    "vendor-cloud-service (public-doc keyword signal; unreviewed)"
  ],
  "external_prerequisites_blocking": false,
  "license_notes": "Independent implementation; no vendor code, assets or documentation text copied.",
  "implementation": {
    "engine": "flowengine",
    "tool_id": "core.macro_input_indb",
    "version": "1.0.0",
    "module": "flowengine.tools.indb",
    "side_effects": "none"
  },
  "reference_observation": null,
  "public_doc": {
    "source": "data/public-doc-audit.json",
    "page_title": "Macro Input In-DB Tool",
    "sha256": "d81ba5992d0632382f0d8771b2df6365c59d65870120dcc13cba5ad638d1b02f",
    "retrieved_utc": "2026-10-13T09:33:24.050447+00:00",
    "anchors_extracted": [],
    "anchor_extraction": "none-found",
    "section_headings": [
      "Configure the Tool"
    ]
  },
  "independent_tests": {
    "count": 1,
    "passing": 1,
    "tests": [
      "test_indb.ExecutionTests.test_in_db_macro_passes_streams"
    ]
  },
  "sources": [
    {
      "url": "https://help.alteryx.com/current/en/designer/tools/designer-tools-list.html",
      "evidence_type": "public-tool-list",
      "accessed_utc": "2026-10-13T09:15:04.301501+00:00"
    },
    {
      "url": "https://help.alteryx.com/current/en/designer/tools/in-database/macro-input-in-db-tool.html",
      "evidence_type": "public-tool-help-page-metadata",
      "accessed_utc": "2026-10-13T09:33:24.050447+00:00"
    }
  ],
  "cases": [],
  "unresolved": [
    "No differential conformance case yet."
  ]
}
