{
  "id": "data-investigation:contingency-table",
  "target_version": "Designer 2026.1.4.126 (pinned public catalogue); reference observations from installed build 2026.2.0.8",
  "name": "Contingency Table",
  "category": "Data Investigation",
  "xml_tool_name": "Predictive Tools\\ContingencyTable.yxmc",
  "user_role": "Full",
  "documentation_url": "https://help.alteryx.com/current/en/designer/tools/data-investigation/contingency-table-tool.html",
  "status": "not-started",
  "implementation_status": "not-started",
  "verification_status": "not-tested",
  "inputs": [],
  "outputs": [
    {
      "name": "D",
      "direction": "output",
      "cardinality": "unknown",
      "provenance": "public-doc-extracted"
    },
    {
      "name": "R",
      "direction": "output",
      "cardinality": "unknown",
      "provenance": "public-doc-extracted"
    },
    {
      "name": "I",
      "direction": "output",
      "cardinality": "unknown",
      "provenance": "public-doc-extracted"
    }
  ],
  "configuration_schema": {
    "status": "not-yet-specified",
    "reference_config_elements": [],
    "public_doc_sections": [
      "Configure the Tool",
      "View the Output"
    ]
  },
  "deterministic": null,
  "external_dependencies": [
    "r-runtime (public-doc keyword signal; unreviewed)",
    "vendor-cloud-service (public-doc keyword signal; unreviewed)"
  ],
  "external_prerequisites_blocking": false,
  "license_notes": "Independent implementation; no vendor code, assets or documentation text copied.",
  "implementation": null,
  "reference_observation": null,
  "public_doc": {
    "source": "data/public-doc-audit.json",
    "page_title": "Contingency Table Tool",
    "sha256": "02f9893131724287832d92242983ea1f0a82a02f4f8b459bdbfa8928d6f40ecf",
    "retrieved_utc": "2026-10-13T09:33:23.563138+00:00",
    "anchors_extracted": [
      {
        "label": "D",
        "letter": "D",
        "direction_guess": "output"
      },
      {
        "label": "R",
        "letter": "R",
        "direction_guess": "output"
      },
      {
        "label": "I",
        "letter": "I",
        "direction_guess": "output"
      }
    ],
    "anchor_extraction": "page-anchor-lines",
    "section_headings": [
      "Configure the Tool",
      "View the Output"
    ]
  },
  "independent_tests": {
    "count": 0,
    "passing": 0,
    "tests": []
  },
  "sources": [
    {
      "url": "https://help.alteryx.com/current/en/designer/tools/designer-tools-list.html",
      "evidence_type": "public-tool-list",
      "accessed_utc": "2026-10-13T09:15:04.301501+00:00"
    },
    {
      "url": "https://help.alteryx.com/current/en/designer/tools/data-investigation/contingency-table-tool.html",
      "evidence_type": "public-tool-help-page-metadata",
      "accessed_utc": "2026-10-13T09:33:23.563138+00:00"
    }
  ],
  "cases": [],
  "unresolved": [
    "No independent kernel yet; configuration semantics not specified."
  ]
}
