{
  "id": "time-series:ts-plot",
  "target_version": "Designer 2026.1.4.126 (pinned public catalogue); reference observations from installed build 2026.2.0.8",
  "name": "TS Plot",
  "category": "Time Series",
  "xml_tool_name": "Predictive Tools\\TS_Plot.yxmc",
  "user_role": "Full",
  "documentation_url": "https://help.alteryx.com/current/en/designer/tools/time-series/ts-plot-tool.html",
  "status": "implemented",
  "implementation_status": "implemented",
  "verification_status": "not-tested",
  "inputs": [
    {
      "name": "input",
      "direction": "input",
      "cardinality": "one",
      "provenance": "flowengine-manifest",
      "reference_name": null
    }
  ],
  "outputs": [
    {
      "name": "chart",
      "direction": "output",
      "cardinality": "one",
      "provenance": "flowengine-manifest",
      "reference_name": null
    },
    {
      "name": "components",
      "direction": "output",
      "cardinality": "one",
      "provenance": "flowengine-manifest",
      "reference_name": null
    }
  ],
  "configuration_schema": {
    "type": "object",
    "additionalProperties": false,
    "required": [
      "date_field",
      "value_field"
    ],
    "properties": {
      "date_field": {
        "type": "string",
        "minLength": 1
      },
      "value_field": {
        "type": "string",
        "minLength": 1
      },
      "group_field": {
        "type": [
          "string",
          "null"
        ],
        "default": null
      },
      "seasonal_period": {
        "type": "integer",
        "minimum": 1,
        "maximum": 400,
        "default": 1
      },
      "title": {
        "type": [
          "string",
          "null"
        ],
        "default": null
      }
    }
  },
  "deterministic": true,
  "external_dependencies": [
    "r-runtime",
    "vendor-cloud-service (public-doc keyword signal; unreviewed)"
  ],
  "external_prerequisites_blocking": false,
  "license_notes": "Independent implementation; no vendor code, assets or documentation text copied.",
  "implementation": {
    "engine": "flowengine",
    "tool_id": "core.ts_plot",
    "version": "1.0.0",
    "module": "flowengine.tools.timeseries",
    "side_effects": "none"
  },
  "reference_observation": null,
  "public_doc": {
    "source": "data/public-doc-audit.json",
    "page_title": "TS Plot Tool",
    "sha256": "8e52c160cd5eaab8e696f87d8a64e6dce1e195672dd9b268762d8877c362797d",
    "retrieved_utc": "2026-10-13T09:33:25.445458+00:00",
    "anchors_extracted": [
      {
        "label": "R",
        "letter": "R",
        "direction_guess": "unknown"
      },
      {
        "label": "I",
        "letter": "I",
        "direction_guess": "unknown"
      }
    ],
    "anchor_extraction": "page-anchor-lines",
    "section_headings": [
      "Connect an Input",
      "Configure the Tool",
      "Configuration Tab",
      "Graphics Options Tab",
      "View the Output"
    ]
  },
  "independent_tests": {
    "count": 2,
    "passing": 2,
    "tests": [
      "test_batch8.ExampleTests.test_diesel_forecast_example",
      "test_batch8.TimeSeriesTests.test_filler_plot_and_factory"
    ]
  },
  "sources": [
    {
      "url": "https://help.alteryx.com/current/en/designer/tools/designer-tools-list.html",
      "evidence_type": "public-tool-list",
      "accessed_utc": "2026-10-13T09:15:04.301501+00:00"
    },
    {
      "url": "https://help.alteryx.com/current/en/designer/tools/time-series/ts-plot-tool.html",
      "evidence_type": "public-tool-help-page-metadata",
      "accessed_utc": "2026-10-13T09:33:25.445458+00:00"
    }
  ],
  "cases": [],
  "unresolved": [
    "No differential conformance case yet."
  ]
}
