{
  "id": "predictive:model-comparison",
  "target_version": "Designer 2026.1.4.126 (pinned public catalogue); reference observations from installed build 2026.2.0.8",
  "name": "Model Comparison",
  "category": "Predictive",
  "xml_tool_name": "Predictive Tools\\Model Comparison.yxmc",
  "user_role": "Full",
  "documentation_url": "https://help.alteryx.com/current/en/designer/tools/predictive/model-comparison-tool.html",
  "status": "not-started",
  "implementation_status": "not-started",
  "verification_status": "not-tested",
  "inputs": [],
  "outputs": [
    {
      "name": "M",
      "direction": "output",
      "cardinality": "unknown",
      "provenance": "public-doc-extracted"
    }
  ],
  "configuration_schema": {
    "status": "not-yet-specified",
    "reference_config_elements": [],
    "public_doc_sections": [
      "Connect Inputs",
      "Configure the Tool",
      "Configuration Option Constraints",
      "View the Output"
    ]
  },
  "deterministic": null,
  "external_dependencies": [
    "r-runtime (statistical models; vendor ships R-based macros)",
    "licensed-dataset (public-doc keyword signal; unreviewed)",
    "vendor-cloud-service (public-doc keyword signal; unreviewed)"
  ],
  "external_prerequisites_blocking": false,
  "license_notes": "Independent implementation; no vendor code, assets or documentation text copied.",
  "implementation": null,
  "reference_observation": null,
  "public_doc": {
    "source": "data/public-doc-audit.json",
    "page_title": "Model Comparison Tool",
    "sha256": "f697ebcfdbe399316f485bf4ace19fda4858e11f208e0ff01839072ad9bdc162",
    "retrieved_utc": "2026-10-13T09:33:24.741202+00:00",
    "anchors_extracted": [
      {
        "label": "M",
        "letter": "M",
        "direction_guess": "output"
      },
      {
        "label": "D",
        "letter": "D",
        "direction_guess": "unknown"
      },
      {
        "label": "E",
        "letter": "E",
        "direction_guess": "unknown"
      },
      {
        "label": "P",
        "letter": "P",
        "direction_guess": "unknown"
      },
      {
        "label": "R",
        "letter": "R",
        "direction_guess": "unknown"
      }
    ],
    "anchor_extraction": "page-anchor-lines",
    "section_headings": [
      "Connect Inputs",
      "Configure the Tool",
      "Configuration Option Constraints",
      "View the Output"
    ]
  },
  "independent_tests": {
    "count": 0,
    "passing": 0,
    "tests": []
  },
  "sources": [
    {
      "url": "https://help.alteryx.com/current/en/designer/tools/designer-tools-list.html",
      "evidence_type": "public-tool-list",
      "accessed_utc": "2026-10-13T09:15:04.301501+00:00"
    },
    {
      "url": "https://help.alteryx.com/current/en/designer/tools/predictive/model-comparison-tool.html",
      "evidence_type": "public-tool-help-page-metadata",
      "accessed_utc": "2026-10-13T09:33:24.741202+00:00"
    }
  ],
  "cases": [],
  "unresolved": [
    "No independent kernel yet; configuration semantics not specified."
  ]
}
