{
  "id": "computer-vision:barcode-tool",
  "target_version": "Designer 2026.1.4.126 (pinned public catalogue); reference observations from installed build 2026.2.0.8",
  "name": "Barcode Tool",
  "category": "Computer Vision",
  "xml_tool_name": "Barcode",
  "user_role": "Full",
  "documentation_url": "https://help.alteryx.com/current/en/designer/tools/alteryx-intelligence-suite/computer-vision/barcode.html",
  "status": "not-started",
  "implementation_status": "not-started",
  "verification_status": "not-tested",
  "inputs": [
    {
      "name": "Input",
      "direction": "input",
      "cardinality": "unknown",
      "provenance": "public-doc-extracted"
    }
  ],
  "outputs": [
    {
      "name": "Output",
      "direction": "output",
      "cardinality": "unknown",
      "provenance": "public-doc-extracted"
    }
  ],
  "configuration_schema": {
    "status": "not-yet-specified",
    "reference_config_elements": [],
    "public_doc_sections": [
      "Supported Barcode Types",
      "Tool Components",
      "Configure the Tool",
      "Generate Barcode from Text",
      "Read Barcode from Image",
      "Output",
      "Generate Barcode from Text",
      "Read Barcode from Image"
    ]
  },
  "deterministic": null,
  "external_dependencies": [
    "python-cv-runtime (image/OCR)",
    "vendor-cloud-service (public-doc keyword signal; unreviewed)"
  ],
  "external_prerequisites_blocking": false,
  "license_notes": "Independent implementation; no vendor code, assets or documentation text copied.",
  "implementation": null,
  "reference_observation": null,
  "public_doc": {
    "source": "data/public-doc-audit.json",
    "page_title": "Barcode",
    "sha256": "11747bfcc9b4982212c573000c2c7c392613c215345778a1d592ee638a8de414",
    "retrieved_utc": "2026-10-13T09:33:22.813340+00:00",
    "anchors_extracted": [
      {
        "label": "Input",
        "letter": null,
        "direction_guess": "input"
      },
      {
        "label": "Output",
        "letter": null,
        "direction_guess": "output"
      }
    ],
    "anchor_extraction": "tool-components-section",
    "section_headings": [
      "Supported Barcode Types",
      "Tool Components",
      "Configure the Tool",
      "Generate Barcode from Text",
      "Read Barcode from Image",
      "Output",
      "Generate Barcode from Text",
      "Read Barcode from Image"
    ]
  },
  "independent_tests": {
    "count": 0,
    "passing": 0,
    "tests": []
  },
  "sources": [
    {
      "url": "https://help.alteryx.com/current/en/designer/tools/designer-tools-list.html",
      "evidence_type": "public-tool-list",
      "accessed_utc": "2026-10-13T09:15:04.301501+00:00"
    },
    {
      "url": "https://help.alteryx.com/current/en/designer/tools/alteryx-intelligence-suite/computer-vision/barcode.html",
      "evidence_type": "public-tool-help-page-metadata",
      "accessed_utc": "2026-10-13T09:33:22.813340+00:00"
    }
  ],
  "cases": [],
  "unresolved": [
    "No independent kernel yet; configuration semantics not specified."
  ]
}
