{
  "id": "in-database:connect-in-db",
  "target_version": "Designer 2026.1.4.126 (pinned public catalogue); reference observations from installed build 2026.2.0.8",
  "name": "Connect In-DB",
  "category": "In-Database",
  "xml_tool_name": "LockInGui.LockInInput.LockInInput",
  "user_role": "Full",
  "documentation_url": "https://help.alteryx.com/current/en/designer/tools/in-database/connect-in-db-tool.html",
  "status": "not-started",
  "implementation_status": "not-started",
  "verification_status": "not-tested",
  "inputs": [],
  "outputs": [],
  "configuration_schema": {
    "status": "not-yet-specified",
    "reference_config_elements": [],
    "public_doc_sections": [
      "Configure the Tool",
      "Add a New In-DB Connection",
      "Use an Existing In-DB Connection",
      "Connect In-DB and Advanced Query Options for Pre/Post-SQL"
    ]
  },
  "deterministic": null,
  "external_dependencies": [
    "database-connection (SQL pushdown target)",
    "credentials (public-doc keyword signal; unreviewed)",
    "database-driver (public-doc keyword signal; unreviewed)",
    "r-runtime (public-doc keyword signal; unreviewed)",
    "vendor-cloud-service (public-doc keyword signal; unreviewed)"
  ],
  "external_prerequisites_blocking": false,
  "license_notes": "Independent implementation; no vendor code, assets or documentation text copied.",
  "implementation": null,
  "reference_observation": null,
  "public_doc": {
    "source": "data/public-doc-audit.json",
    "page_title": "Connect In-DB Tool",
    "sha256": "a3420caf9dfc2d6a715b524f37bbe153c4fab452a6f01bee33c07a9d5b903104",
    "retrieved_utc": "2026-10-13T09:33:23.997427+00:00",
    "anchors_extracted": [],
    "anchor_extraction": "none-found",
    "section_headings": [
      "Configure the Tool",
      "Add a New In-DB Connection",
      "Use an Existing In-DB Connection",
      "Connect In-DB and Advanced Query Options for Pre/Post-SQL"
    ]
  },
  "independent_tests": {
    "count": 0,
    "passing": 0,
    "tests": []
  },
  "sources": [
    {
      "url": "https://help.alteryx.com/current/en/designer/tools/designer-tools-list.html",
      "evidence_type": "public-tool-list",
      "accessed_utc": "2026-10-13T09:15:04.301501+00:00"
    },
    {
      "url": "https://help.alteryx.com/current/en/designer/tools/in-database/connect-in-db-tool.html",
      "evidence_type": "public-tool-help-page-metadata",
      "accessed_utc": "2026-10-13T09:33:23.997427+00:00"
    }
  ],
  "cases": [],
  "unresolved": [
    "No independent kernel yet; configuration semantics not specified.",
    "Anchors unknown: not described in public page text and not observed in shipped workflows."
  ]
}
