{
  "id": "interface:file-browse",
  "target_version": "Designer 2026.1.4.126 (pinned public catalogue); reference observations from installed build 2026.2.0.8",
  "name": "File Browse",
  "category": "Interface",
  "xml_tool_name": "AlteryxGuiToolkit.Questions.FileBrowse.FileBrowse",
  "user_role": "Full",
  "documentation_url": "https://help.alteryx.com/current/en/designer/tools/interface-tools/file-browse-tool.html",
  "status": "in-progress",
  "implementation_status": "in-progress",
  "verification_status": "not-tested",
  "inputs": [],
  "outputs": [
    {
      "name": "Question",
      "direction": "output",
      "cardinality": "unknown",
      "provenance": "reference-observed"
    }
  ],
  "configuration_schema": {
    "status": "partially-specified",
    "source": "docs/INTERFACE_APPLICATIONS.md",
    "supported_variants": [
      "Native open-mode answer must be an existing file and save-mode answer a file path in an existing folder, resolved against the workflow directory",
      "Optional extension filter applied in the native picker and enforced by the engine; selected path bound through configured actions"
    ],
    "unsupported_variants": [
      "Authentic Alteryx File Browse XML configuration, file-type filter syntax and Gallery/Server upload behaviour are not verified"
    ],
    "preserved_runtime_xml": true
  },
  "deterministic": null,
  "external_dependencies": [
    "analytic-app-and-macro-runtime",
    "alteryx-server (public-doc keyword signal; unreviewed)",
    "vendor-cloud-service (public-doc keyword signal; unreviewed)"
  ],
  "external_prerequisites_blocking": false,
  "license_notes": "Independent implementation; no vendor code, assets or documentation text copied.",
  "implementation": {
    "engine": "Flowbench native analytic-app File Browse question adapter",
    "tool_id": "interface:file-browse",
    "module": "flowengine.interface_app + desktop/src/ui/dialogs.tsx",
    "supported_variants": [
      "Native open-mode answer must be an existing file and save-mode answer a file path in an existing folder, resolved against the workflow directory",
      "Optional extension filter applied in the native picker and enforced by the engine; selected path bound through configured actions"
    ],
    "unimplemented_variants": [
      "Authentic Alteryx File Browse XML configuration, file-type filter syntax and Gallery/Server upload behaviour are not verified"
    ]
  },
  "reference_observation": {
    "source": "data/reference-observations.json",
    "build": "2026.2.0.8",
    "tool_identifiers": [
      "AlteryxGuiToolkit.Questions.FileBrowse.FileBrowse"
    ],
    "input_anchors": [],
    "output_anchors": [
      "Question"
    ],
    "config_elements": [],
    "nodes_observed": 18
  },
  "public_doc": {
    "source": "data/public-doc-audit.json",
    "page_title": "File Browse Tool",
    "sha256": "4d5897cbbb69a5157e90bcc800dca4f766353834c78ec1b8aac7b71e23ffd809",
    "retrieved_utc": "2026-10-13T09:33:24.293608+00:00",
    "anchors_extracted": [],
    "anchor_extraction": "none-found",
    "section_headings": [
      "Configure the Tool",
      "Allowed File Types for Upload"
    ]
  },
  "independent_tests": {
    "count": 2,
    "passing": 2,
    "tests": [
      "test_fe_interop.ImportTests.test_native_browse_questions_check_extension_mode_and_existence",
      "test_fe_service.ServiceTests.test_browse_answers_choose_input_output_and_folder_for_real_execution"
    ]
  },
  "sources": [
    {
      "url": "https://help.alteryx.com/current/en/designer/tools/designer-tools-list.html",
      "evidence_type": "public-tool-list",
      "accessed_utc": "2026-10-13T09:15:04.301501+00:00"
    },
    {
      "url": "https://help.alteryx.com/current/en/designer/tools/interface-tools/file-browse-tool.html",
      "evidence_type": "public-tool-help-page-metadata",
      "accessed_utc": "2026-10-13T09:33:24.293608+00:00"
    },
    {
      "url": "data/reference-observations.json",
      "evidence_type": "authorised-reference-structural-scan",
      "accessed_utc": "2026-10-13T09:34:26+00:00"
    },
    {
      "url": "docs/INTERFACE_APPLICATIONS.md",
      "evidence_type": "project-authored-runtime-and-ui-evidence",
      "accessed_utc": "2026-10-13T09:15:04.301501+00:00"
    }
  ],
  "cases": [],
  "unresolved": [
    "No independent row-processing kernel; this entry is implemented as a workflow application adapter."
  ]
}
