{
  "id": "address:parse-address",
  "target_version": "Designer 2026.1.4.126 (pinned public catalogue); reference observations from installed build 2026.2.0.8",
  "name": "Parse Address",
  "category": "Address",
  "xml_tool_name": "AlteryxCASSGui.CASSParse.CASSParse",
  "user_role": "Full",
  "documentation_url": "https://help.alteryx.com/current/en/designer/tools/address/parse-address-tool.html",
  "status": "not-started",
  "implementation_status": "not-started",
  "verification_status": "not-tested",
  "inputs": [],
  "outputs": [],
  "configuration_schema": {
    "status": "not-yet-specified",
    "reference_config_elements": [],
    "public_doc_sections": [
      "Configure the Tool",
      "Output Fields Definitions"
    ]
  },
  "deterministic": null,
  "external_dependencies": [
    "licensed-reference-dataset (address/geocoding data)",
    "licensed-dataset (public-doc keyword signal; unreviewed)",
    "vendor-cloud-service (public-doc keyword signal; unreviewed)"
  ],
  "external_prerequisites_blocking": true,
  "license_notes": "Independent implementation; no vendor code, assets or documentation text copied.",
  "implementation": null,
  "reference_observation": null,
  "public_doc": {
    "source": "data/public-doc-audit.json",
    "page_title": "Parse Address Tool",
    "sha256": "a6c930977befc85e118b0f8e0621d8ef9a7651b0a53f1d65ee2e0ceec275763c",
    "retrieved_utc": "2026-10-13T09:33:22.708255+00:00",
    "anchors_extracted": [],
    "anchor_extraction": "none-found",
    "section_headings": [
      "Configure the Tool",
      "Output Fields Definitions"
    ]
  },
  "independent_tests": {
    "count": 0,
    "passing": 0,
    "tests": []
  },
  "sources": [
    {
      "url": "https://help.alteryx.com/current/en/designer/tools/designer-tools-list.html",
      "evidence_type": "public-tool-list",
      "accessed_utc": "2026-10-13T09:15:04.301501+00:00"
    },
    {
      "url": "https://help.alteryx.com/current/en/designer/tools/address/parse-address-tool.html",
      "evidence_type": "public-tool-help-page-metadata",
      "accessed_utc": "2026-10-13T09:33:22.708255+00:00"
    }
  ],
  "cases": [],
  "unresolved": [
    "No independent kernel yet; configuration semantics not specified.",
    "Anchors unknown: not described in public page text and not observed in shipped workflows.",
    "Exact behaviour needs separately licensed data/services; record authorised sandbox access before testing."
  ]
}
