{
  "id": "laboratory:jupyter-flow",
  "target_version": "Designer 2026.1.4.126 (pinned public catalogue); reference observations from installed build 2026.2.0.8",
  "name": "Jupyter Flow",
  "category": "Laboratory",
  "xml_tool_name": "JupyterFlow",
  "user_role": "Full",
  "documentation_url": "https://help.alteryx.com/current/en/designer/tools/laboratory/jupyter-flow.html",
  "status": "not-started",
  "implementation_status": "not-started",
  "verification_status": "not-tested",
  "inputs": [
    {
      "name": "Multi-input",
      "direction": "input",
      "cardinality": "unknown",
      "provenance": "public-doc-extracted"
    }
  ],
  "outputs": [
    {
      "name": "Output",
      "direction": "output",
      "cardinality": "unknown",
      "provenance": "public-doc-extracted"
    }
  ],
  "configuration_schema": {
    "status": "not-yet-specified",
    "reference_config_elements": [],
    "public_doc_sections": [
      "Tool Components",
      "Configure the Tool",
      "Required Syntax",
      "Input Data",
      "Output Data",
      "Manage Packages",
      "Advanced",
      "Data Cache Location",
      "Back Up Data Cache",
      "Enter Custom Path to Zip App",
      "Share Workflows That Contain Zip Apps"
    ]
  },
  "deterministic": null,
  "external_dependencies": [
    "experimental-in-reference",
    "python-runtime (public-doc keyword signal; unreviewed)",
    "vendor-cloud-service (public-doc keyword signal; unreviewed)"
  ],
  "external_prerequisites_blocking": false,
  "license_notes": "Independent implementation; no vendor code, assets or documentation text copied.",
  "implementation": null,
  "reference_observation": null,
  "public_doc": {
    "source": "data/public-doc-audit.json",
    "page_title": "Jupyter Flow",
    "sha256": "933d1a6623c2d1cb475e015e605e1dc213a8967f026766aa78b01b675e522231",
    "retrieved_utc": "2026-10-13T09:33:24.437457+00:00",
    "anchors_extracted": [
      {
        "label": "Multi-input",
        "letter": null,
        "direction_guess": "input"
      },
      {
        "label": "Output",
        "letter": null,
        "direction_guess": "output"
      }
    ],
    "anchor_extraction": "tool-components-section",
    "section_headings": [
      "Tool Components",
      "Configure the Tool",
      "Required Syntax",
      "Input Data",
      "Output Data",
      "Manage Packages",
      "Advanced",
      "Data Cache Location",
      "Back Up Data Cache",
      "Enter Custom Path to Zip App",
      "Share Workflows That Contain Zip Apps"
    ]
  },
  "independent_tests": {
    "count": 0,
    "passing": 0,
    "tests": []
  },
  "sources": [
    {
      "url": "https://help.alteryx.com/current/en/designer/tools/designer-tools-list.html",
      "evidence_type": "public-tool-list",
      "accessed_utc": "2026-10-13T09:15:04.301501+00:00"
    },
    {
      "url": "https://help.alteryx.com/current/en/designer/tools/laboratory/jupyter-flow.html",
      "evidence_type": "public-tool-help-page-metadata",
      "accessed_utc": "2026-10-13T09:33:24.437457+00:00"
    }
  ],
  "cases": [],
  "unresolved": [
    "No independent kernel yet; configuration semantics not specified."
  ]
}
