{
  "id": "spatial:distance",
  "target_version": "Designer 2026.1.4.126 (pinned public catalogue); reference observations from installed build 2026.2.0.8",
  "name": "Distance",
  "category": "Spatial",
  "xml_tool_name": "AlteryxSpatialPluginsGui.Distance.Distance",
  "user_role": "Full",
  "documentation_url": "https://help.alteryx.com/current/en/designer/tools/spatial/distance-tool.html",
  "status": "implemented",
  "implementation_status": "implemented",
  "verification_status": "not-tested",
  "inputs": [
    {
      "name": "input",
      "direction": "input",
      "cardinality": "one",
      "provenance": "flowengine-manifest",
      "reference_name": null
    }
  ],
  "outputs": [
    {
      "name": "output",
      "direction": "output",
      "cardinality": "one",
      "provenance": "flowengine-manifest",
      "reference_name": null
    }
  ],
  "configuration_schema": {
    "type": "object",
    "additionalProperties": false,
    "required": [
      "source_field",
      "target_field"
    ],
    "properties": {
      "source_field": {
        "type": "string",
        "minLength": 1
      },
      "target_field": {
        "type": "string",
        "minLength": 1
      },
      "crs": {
        "type": "string",
        "minLength": 1,
        "default": "EPSG:4326",
        "description": "Coordinate reference system of the geometry, e.g. EPSG:4326 (lon/lat) or EPSG:27700"
      },
      "method": {
        "enum": [
          "geodesic",
          "planar"
        ],
        "default": "geodesic"
      },
      "units": {
        "enum": [
          "m",
          "km",
          "mi",
          "ft",
          "nmi"
        ],
        "default": "km"
      },
      "on_invalid": {
        "enum": [
          "error",
          "null"
        ],
        "default": "error",
        "description": "Unparseable or invalid geometry: stop the run, or output null"
      }
    }
  },
  "deterministic": true,
  "external_dependencies": [
    "spatial-geometry-library",
    "licensed-dataset (public-doc keyword signal; unreviewed)",
    "vendor-cloud-service (public-doc keyword signal; unreviewed)"
  ],
  "external_prerequisites_blocking": false,
  "license_notes": "Independent implementation; no vendor code, assets or documentation text copied.",
  "implementation": {
    "engine": "flowengine",
    "tool_id": "core.distance",
    "version": "1.0.0",
    "module": "flowengine.tools.spatial",
    "side_effects": "none"
  },
  "reference_observation": {
    "source": "data/reference-observations.json",
    "build": "2026.2.0.8",
    "tool_identifiers": [
      "AlteryxSpatialPluginsGui.Distance.Distance"
    ],
    "input_anchors": [
      "Input"
    ],
    "output_anchors": [
      "Output"
    ],
    "config_elements": [
      "AllowReverseRoute",
      "DistToInsideEdge",
      "DriveDistanceOnly",
      "DriveTimeDataSet",
      "IsMetric",
      "MaxDriveTime",
      "OutputCardinalDirection",
      "OutputDirectionDegrees",
      "OutputDistance",
      "OutputDriveTimeAndDistance",
      "OutputUnits",
      "ReturnNearest",
      "SortForSpeed",
      "SpatialObjDest",
      "SpatialObjSource"
    ],
    "nodes_observed": 9
  },
  "public_doc": {
    "source": "data/public-doc-audit.json",
    "page_title": "Distance Tool",
    "sha256": "3c62451ca6a5d652fde746bb20a43bacb6b9cf6bb3db4ee0075b22e22fa58df7",
    "retrieved_utc": "2026-10-13T09:33:25.260882+00:00",
    "anchors_extracted": [],
    "anchor_extraction": "none-found",
    "section_headings": [
      "Configure the Tool"
    ]
  },
  "independent_tests": {
    "count": 2,
    "passing": 2,
    "tests": [
      "test_spatial.ExampleTests.test_uk_spatial_example",
      "test_spatial.PointsDistanceTests.test_geodesic_and_planar_distance"
    ]
  },
  "sources": [
    {
      "url": "https://help.alteryx.com/current/en/designer/tools/designer-tools-list.html",
      "evidence_type": "public-tool-list",
      "accessed_utc": "2026-10-13T09:15:04.301501+00:00"
    },
    {
      "url": "https://help.alteryx.com/current/en/designer/tools/spatial/distance-tool.html",
      "evidence_type": "public-tool-help-page-metadata",
      "accessed_utc": "2026-10-13T09:33:25.260882+00:00"
    },
    {
      "url": "data/reference-observations.json",
      "evidence_type": "authorised-reference-structural-scan",
      "accessed_utc": "2026-10-13T09:34:26+00:00"
    }
  ],
  "cases": [],
  "unresolved": [
    "No differential conformance case yet."
  ]
}
