{
  "id": "demographic-analysis:allocate-append",
  "target_version": "Designer 2026.1.4.126 (pinned public catalogue); reference observations from installed build 2026.2.0.8",
  "name": "Allocate Append",
  "category": "Demographic Analysis",
  "xml_tool_name": "PortfolioPluginsGui.AllocateAppend.AllocateAppend",
  "user_role": "Full",
  "documentation_url": "https://help.alteryx.com/current/en/designer/tools/demographic-analysis/allocate-append-tool.html",
  "status": "implemented",
  "implementation_status": "implemented",
  "verification_status": "not-tested",
  "inputs": [
    {
      "name": "input",
      "direction": "input",
      "cardinality": "one",
      "provenance": "flowengine-manifest",
      "reference_name": null
    }
  ],
  "outputs": [
    {
      "name": "output",
      "direction": "output",
      "cardinality": "one",
      "provenance": "flowengine-manifest",
      "reference_name": null
    }
  ],
  "configuration_schema": {
    "type": "object",
    "additionalProperties": false,
    "required": [
      "provider",
      "connection_id",
      "key_field",
      "level",
      "variables"
    ],
    "properties": {
      "provider": {
        "type": "string",
        "enum": [
          "us-census-acs"
        ]
      },
      "provider_semantics": {
        "type": "string"
      },
      "connection_id": {
        "type": "string",
        "minLength": 1,
        "x-flowbench-connection": "web",
        "description": "https://api.census.gov/data, Signed URL with key=<your key>"
      },
      "year": {
        "type": "integer",
        "minimum": 2009,
        "maximum": 2100,
        "default": 2023
      },
      "dataset": {
        "enum": [
          "acs/acs5",
          "acs/acs1",
          "acs/acs5/profile",
          "acs/acs5/subject"
        ],
        "default": "acs/acs5"
      },
      "timeout_seconds": {
        "type": "number",
        "exclusiveMinimum": 0,
        "maximum": 600,
        "default": 120
      },
      "variables": {
        "type": "array",
        "minItems": 1,
        "uniqueItems": true,
        "items": {
          "type": "string",
          "pattern": "^[A-Z][A-Z0-9_]{2,30}$"
        },
        "description": "ACS variable codes, e.g. B01003_001E (total population); see Allocate MetaInfo"
      },
      "key_field": {
        "type": "string",
        "minLength": 1
      },
      "level": {
        "enum": [
          "state",
          "county",
          "tract",
          "block group",
          "zip code tabulation area"
        ]
      },
      "prefix": {
        "type": "string",
        "default": ""
      }
    }
  },
  "deterministic": false,
  "external_dependencies": [
    "licensed-reference-dataset (demographic data)",
    "licensed-dataset (public-doc keyword signal; unreviewed)",
    "vendor-cloud-service (public-doc keyword signal; unreviewed)"
  ],
  "external_prerequisites_blocking": true,
  "license_notes": "Independent implementation; no vendor code, assets or documentation text copied.",
  "implementation": {
    "engine": "flowengine",
    "tool_id": "core.allocate_append",
    "version": "1.0.0",
    "module": "flowengine.tools.demographics",
    "side_effects": "network"
  },
  "reference_observation": null,
  "public_doc": {
    "source": "data/public-doc-audit.json",
    "page_title": "Allocate Append Tool",
    "sha256": "f1f33a61bc6a2967f5da3d794c4c32d598c8caf323c0cb118e47a2d1727fe0b3",
    "retrieved_utc": "2026-10-13T09:33:23.655497+00:00",
    "anchors_extracted": [],
    "anchor_extraction": "none-found",
    "section_headings": [
      "Configure the Tool"
    ]
  },
  "independent_tests": {
    "count": 1,
    "passing": 1,
    "tests": [
      "test_demographics_calgary.AllocateTests.test_append_matches_geoids_one_request_per_state_and_chunks_variables"
    ]
  },
  "sources": [
    {
      "url": "https://help.alteryx.com/current/en/designer/tools/designer-tools-list.html",
      "evidence_type": "public-tool-list",
      "accessed_utc": "2026-10-13T09:15:04.301501+00:00"
    },
    {
      "url": "https://help.alteryx.com/current/en/designer/tools/demographic-analysis/allocate-append-tool.html",
      "evidence_type": "public-tool-help-page-metadata",
      "accessed_utc": "2026-10-13T09:33:23.655497+00:00"
    }
  ],
  "cases": [],
  "unresolved": [
    "Exact behaviour needs separately licensed data/services; record authorised sandbox access before testing.",
    "No differential conformance case yet.",
    "Provider us-census-acs: Checked against a controlled fixture of the documented data, variables and groups endpoints. The data API now requires a key; live acceptance is pending (no key available here; keys are free)."
  ]
}
