{
  "id": "transform:count-records",
  "target_version": "Designer 2026.1.4.126 (pinned public catalogue); reference observations from installed build 2026.2.0.8",
  "name": "Count Records",
  "category": "Transform",
  "xml_tool_name": "CountRecords.yxmc",
  "user_role": "Full",
  "documentation_url": "https://help.alteryx.com/current/en/designer/tools/transform/count-records-tool.html",
  "status": "implemented",
  "implementation_status": "implemented",
  "verification_status": "partial",
  "inputs": [
    {
      "name": "input",
      "direction": "input",
      "cardinality": "one",
      "provenance": "flowengine-manifest",
      "reference_name": "Input8"
    }
  ],
  "outputs": [
    {
      "name": "output",
      "direction": "output",
      "cardinality": "one",
      "provenance": "flowengine-manifest",
      "reference_name": "Output9"
    }
  ],
  "configuration_schema": {
    "type": "object",
    "additionalProperties": false,
    "properties": {
      "field_name": {
        "type": "string",
        "minLength": 1,
        "default": "Count"
      }
    }
  },
  "deterministic": true,
  "external_dependencies": [
    "vendor-cloud-service (public-doc keyword signal; unreviewed)"
  ],
  "external_prerequisites_blocking": false,
  "license_notes": "Independent implementation; no vendor code, assets or documentation text copied.",
  "implementation": {
    "engine": "flowengine",
    "tool_id": "core.count_records",
    "version": "1.0.0",
    "module": "flowengine.tools.transform",
    "side_effects": "none"
  },
  "reference_observation": {
    "source": "data/reference-observations.json",
    "build": "2026.2.0.8",
    "tool_identifiers": [
      "CountRecords.yxmc"
    ],
    "input_anchors": [
      "Input8"
    ],
    "output_anchors": [
      "Output9"
    ],
    "config_elements": [
      "Value"
    ],
    "nodes_observed": 10
  },
  "public_doc": {
    "source": "data/public-doc-audit.json",
    "page_title": "Count Records Tool",
    "sha256": "7030eb0e2814d7d6695ea4be44b509a232bbb61fb06bb8e4f8fca3b944274039",
    "retrieved_utc": "2026-10-13T09:33:25.456662+00:00",
    "anchors_extracted": [],
    "anchor_extraction": "none-found",
    "section_headings": [
      "Configure the Tool"
    ]
  },
  "independent_tests": {
    "count": 14,
    "passing": 14,
    "tests": [
      "test_control_container.ControlContainerTests.test_chained_containers_run_in_sequence_through_a_file",
      "test_control_container.ControlContainerTests.test_disabled_container_skips_contents",
      "test_control_container.ControlContainerTests.test_empty_control_input_skips_contents_and_their_downstream",
      "test_control_container.ControlContainerTests.test_inactive_container_stops_a_chain_and_nested_containers",
      "test_control_container.ControlContainerTests.test_invalid_membership_and_control_are_reported",
      "test_control_container.ControlContainerTests.test_unconnected_container_runs_children_then_logs_them",
      "test_fe_executor.ExecutionTests.test_cancellation",
      "test_fe_executor.ExecutionTests.test_disabled_flowbench_tool_container_children_skip_execution",
      "test_fe_executor.ExecutionTests.test_disabled_nodes_skip_descendants",
      "test_fe_executor.ExecutionTests.test_failure_reports_node_and_skips_downstream",
      "test_fe_executor.ExecutionTests.test_fan_out_and_release",
      "test_fe_executor.ValidationTests.test_catalog_id_resolves_to_implementation",
      "test_fe_service.ServiceTests.test_async_run_streams_events_and_finishes",
      "test_fe_tools.TransformTests.test_count_records"
    ]
  },
  "sources": [
    {
      "url": "https://help.alteryx.com/current/en/designer/tools/designer-tools-list.html",
      "evidence_type": "public-tool-list",
      "accessed_utc": "2026-10-13T09:15:04.301501+00:00"
    },
    {
      "url": "https://help.alteryx.com/current/en/designer/tools/transform/count-records-tool.html",
      "evidence_type": "public-tool-help-page-metadata",
      "accessed_utc": "2026-10-13T09:33:25.456662+00:00"
    },
    {
      "url": "data/reference-observations.json",
      "evidence_type": "authorised-reference-structural-scan",
      "accessed_utc": "2026-10-13T09:34:26+00:00"
    }
  ],
  "cases": [
    {
      "case_id": "count-records-macro",
      "status": "passed",
      "evidence": [
        "conformance/results/2026.2.0.8/e1/results.json#count-records-macro",
        "reference build 2026.2.0.8 (e1)",
        "config sha256 0086dfb807a2972a395dad30a3e842ea4b3eb781fd9b381091f19535ef3576e5"
      ]
    },
    {
      "case_id": "count-records-macro",
      "status": "passed",
      "evidence": [
        "conformance/results/2026.2.0.8/e2/results.json#count-records-macro",
        "reference build 2026.2.0.8 (e2)",
        "config sha256 0086dfb807a2972a395dad30a3e842ea4b3eb781fd9b381091f19535ef3576e5"
      ]
    }
  ],
  "unresolved": []
}
