{
  "id": "predictive-grouping:k-centroids-diagnostics",
  "target_version": "Designer 2026.1.4.126 (pinned public catalogue); reference observations from installed build 2026.2.0.8",
  "name": "K-Centroids Diagnostics",
  "category": "Predictive Grouping",
  "xml_tool_name": "Predictive Tools\\K-Centroids_Diagnostics.yxmc",
  "user_role": "Full",
  "documentation_url": "https://help.alteryx.com/current/en/designer/tools/predictive-grouping/k-centroids-diagnostics-tool.html",
  "status": "implemented",
  "implementation_status": "implemented",
  "verification_status": "not-tested",
  "inputs": [
    {
      "name": "input",
      "direction": "input",
      "cardinality": "one",
      "provenance": "flowengine-manifest",
      "reference_name": null
    }
  ],
  "outputs": [
    {
      "name": "output",
      "direction": "output",
      "cardinality": "one",
      "provenance": "flowengine-manifest",
      "reference_name": null
    },
    {
      "name": "chart",
      "direction": "output",
      "cardinality": "one",
      "provenance": "flowengine-manifest",
      "reference_name": null
    }
  ],
  "configuration_schema": {
    "type": "object",
    "additionalProperties": false,
    "required": [
      "fields"
    ],
    "properties": {
      "fields": {
        "type": "array",
        "uniqueItems": true,
        "minItems": 1,
        "items": {
          "type": "string",
          "minLength": 1
        }
      },
      "k_min": {
        "type": "integer",
        "minimum": 2,
        "default": 2
      },
      "k_max": {
        "type": "integer",
        "minimum": 2,
        "maximum": 50,
        "default": 8
      },
      "standardize": {
        "type": "boolean",
        "default": true
      },
      "bootstrap": {
        "type": "integer",
        "minimum": 0,
        "maximum": 100,
        "default": 10
      },
      "seed": {
        "type": "integer",
        "minimum": 0,
        "default": 1
      }
    }
  },
  "deterministic": true,
  "external_dependencies": [
    "r-runtime",
    "vendor-cloud-service (public-doc keyword signal; unreviewed)"
  ],
  "external_prerequisites_blocking": false,
  "license_notes": "Independent implementation; no vendor code, assets or documentation text copied.",
  "implementation": {
    "engine": "flowengine",
    "tool_id": "core.k_centroids_diagnostics",
    "version": "1.0.0",
    "module": "flowengine.tools.grouping",
    "side_effects": "none"
  },
  "reference_observation": null,
  "public_doc": {
    "source": "data/public-doc-audit.json",
    "page_title": "K-Centroids Diagnostics Tool",
    "sha256": "3ad0223d2865e4ee8c25be00b4deeca711810433bbd326fb0c83a1b0f43dee10",
    "retrieved_utc": "2026-10-13T09:33:24.541009+00:00",
    "anchors_extracted": [],
    "anchor_extraction": "none-found",
    "section_headings": [
      "Configure the Tool",
      "Configuration Tab",
      "Graphic Options Tab"
    ]
  },
  "independent_tests": {
    "count": 1,
    "passing": 1,
    "tests": [
      "test_batch8.GroupingTests.test_diagnostics_prefer_the_true_k"
    ]
  },
  "sources": [
    {
      "url": "https://help.alteryx.com/current/en/designer/tools/designer-tools-list.html",
      "evidence_type": "public-tool-list",
      "accessed_utc": "2026-10-13T09:15:04.301501+00:00"
    },
    {
      "url": "https://help.alteryx.com/current/en/designer/tools/predictive-grouping/k-centroids-diagnostics-tool.html",
      "evidence_type": "public-tool-help-page-metadata",
      "accessed_utc": "2026-10-13T09:33:24.541009+00:00"
    }
  ],
  "cases": [],
  "unresolved": [
    "No differential conformance case yet."
  ]
}
