{
  "id": "interface:control-parameter",
  "target_version": "Designer 2026.1.4.126 (pinned public catalogue); reference observations from installed build 2026.2.0.8",
  "name": "Control Parameter",
  "category": "Interface",
  "xml_tool_name": "AlteryxGuiToolkit.Questions.ControlParam.ControlParam",
  "user_role": "Full",
  "documentation_url": "https://help.alteryx.com/current/en/designer/tools/interface-tools/control-parameter-tool.html",
  "status": "in-progress",
  "implementation_status": "in-progress",
  "verification_status": "not-tested",
  "inputs": [],
  "outputs": [
    {
      "name": "Question",
      "direction": "output",
      "cardinality": "unknown",
      "provenance": "reference-observed"
    }
  ],
  "configuration_schema": {
    "status": "partially-specified",
    "source": "docs/INTERFACE_APPLICATIONS.md",
    "supported_variants": [
      "Native control-parameter question maps a parent control-record field to connected child configuration actions for each ordered Batch Macro invocation"
    ],
    "unsupported_variants": [
      "Authentic Alteryx Control Parameter XML/action connection mapping is not verified"
    ],
    "preserved_runtime_xml": true
  },
  "deterministic": null,
  "external_dependencies": [
    "analytic-app-and-macro-runtime",
    "vendor-cloud-service (public-doc keyword signal; unreviewed)"
  ],
  "external_prerequisites_blocking": false,
  "license_notes": "Independent implementation; no vendor code, assets or documentation text copied.",
  "implementation": {
    "engine": "Flowbench batch-macro control parameter adapter",
    "tool_id": "interface:control-parameter",
    "module": "flowengine.tools.macros.BatchMacro + flowengine.interface_app",
    "supported_variants": [
      "Native control-parameter question maps a parent control-record field to connected child configuration actions for each ordered Batch Macro invocation"
    ],
    "unimplemented_variants": [
      "Authentic Alteryx Control Parameter XML/action connection mapping is not verified"
    ]
  },
  "reference_observation": {
    "source": "data/reference-observations.json",
    "build": "2026.2.0.8",
    "tool_identifiers": [
      "AlteryxGuiToolkit.Questions.ControlParam.ControlParam"
    ],
    "input_anchors": [],
    "output_anchors": [
      "Question"
    ],
    "config_elements": [],
    "nodes_observed": 12
  },
  "public_doc": {
    "source": "data/public-doc-audit.json",
    "page_title": "Control Parameter Tool",
    "sha256": "4dbf6c20c4d04f4b7ab771fc2a4666c7fc4f32d84539c748905d2997d68b6974",
    "retrieved_utc": "2026-10-13T09:33:24.262048+00:00",
    "anchors_extracted": [],
    "anchor_extraction": "none-found",
    "section_headings": [
      "Configure the Tool"
    ]
  },
  "independent_tests": {
    "count": 1,
    "passing": 1,
    "tests": [
      "test_macros.BatchMacroTests.test_native_control_parameter_uses_each_parent_row_and_updates_child_configuration"
    ]
  },
  "sources": [
    {
      "url": "https://help.alteryx.com/current/en/designer/tools/designer-tools-list.html",
      "evidence_type": "public-tool-list",
      "accessed_utc": "2026-10-13T09:15:04.301501+00:00"
    },
    {
      "url": "https://help.alteryx.com/current/en/designer/tools/interface-tools/control-parameter-tool.html",
      "evidence_type": "public-tool-help-page-metadata",
      "accessed_utc": "2026-10-13T09:33:24.262048+00:00"
    },
    {
      "url": "data/reference-observations.json",
      "evidence_type": "authorised-reference-structural-scan",
      "accessed_utc": "2026-10-13T09:34:26+00:00"
    },
    {
      "url": "docs/INTERFACE_APPLICATIONS.md",
      "evidence_type": "authorised-reference-observation-and-project-authored-execution",
      "accessed_utc": "2026-10-13T09:15:04.301501+00:00"
    }
  ],
  "cases": [],
  "unresolved": [
    "No independent row-processing kernel; this entry is implemented as a workflow application adapter."
  ]
}
